[
  {
    "company": "Example Company",
    "title": "Senior Data Engineer - Azure Databricks",
    "location": "Remote, Germany",
    "work_mode": "Remote",
    "salary": "not specified",
    "source": "manual indexed search",
    "url": "https://example.com/job",
    "language": "English required; German is a plus",
    "priority": "A",
    "contract_type": "Permanent",
    "core_tech_match": "Azure, Databricks, Python, SQL",
    "fit_score": 8.5,
    "status": "NEW",
    "analysis": "Example vacancy format for JobBot Eng Ind with a direct role page and Germany-compatible remote work.",
    "recommendation": "Review the original posting before applying.",
    "found_at": "2026-08-17T10:00:00+00:00",
    "source_group": "Company career pages",
    "language_risk": "low",
    "salary_likelihood": "high"
  }
]
